{"atlas_root":"sha256:9b61b25bd0f7fc1f047f89c4be4e30472616eda903e2fbe8c4d32f9c4d45d132","audience":"human","derived":true,"kind":"xinfa.atlas-view/v1","routes":[{"audience":"human","authorityRoot":"sha256:5c2ebe6adff2dc6f17f9515329456a21511a8b2316c9cebaa7883d6ef4082fd6","entrypoints":["README.md","xinfa/README.md"],"id":"kungfu-xinfa-dogfood.human","nodes":["kungfu.claim.shared-context","kungfu.doc.xinfa","kungfu.evidence.adapters","kungfu.evidence.dev-cache-scope-closure","kungfu.impl.consumer","kungfu.impl.projection","kungfu.impl.shifu-adapter","kungfu.narrative.practice"],"parityGroup":"kungfu-xinfa-dogfood.contributor","routeRoot":"sha256:0163d77c29760eba28a4fa5ede640ef8dec9fdc2505aaa23100249ab7cee0677","status":"current","visibility":"public"}],"schema":"xinfa.atlas-view/v1","shared":{"atlas_root":"sha256:9b61b25bd0f7fc1f047f89c4be4e30472616eda903e2fbe8c4d32f9c4d45d132","cut":{"id":"kungfu.dev-cache-scope-closure","revision":"sha256:8bcca7654702136cdd863e3f63c668c557acf191b25d5535f62860731de35494"},"cut_root":"sha256:0a19bb9f41b9c99698826ec6f2e2df333d7292c944a6c1ddeda7cce2c8022ed0","evidence":[{"claim":"kungfu.claim.shared-context","documents":["kungfu.doc.xinfa"],"evidence":["kungfu.evidence.adapters"],"implementations":["kungfu.impl.consumer","kungfu.impl.projection","kungfu.impl.shifu-adapter"],"probes":[],"routes":["kungfu-xinfa-dogfood.agent","kungfu-xinfa-dogfood.human"],"status":"machine-proved"}],"expansion_handles":[{"nodes":["kungfu.claim.shared-context","kungfu.doc.xinfa","kungfu.evidence.adapters","kungfu.evidence.dev-cache-scope-closure","kungfu.impl.consumer","kungfu.impl.projection","kungfu.impl.shifu-adapter","kungfu.narrative.practice"],"route":"kungfu-xinfa-dogfood.agent","routeRoot":"sha256:83aa572bffd2fac9d8bbbfbcfacac2363fc342a50f2314f45db07b74847a3c2b"},{"nodes":["kungfu.claim.shared-context","kungfu.doc.xinfa","kungfu.evidence.adapters","kungfu.evidence.dev-cache-scope-closure","kungfu.impl.consumer","kungfu.impl.projection","kungfu.impl.shifu-adapter","kungfu.narrative.practice"],"route":"kungfu-xinfa-dogfood.human","routeRoot":"sha256:0163d77c29760eba28a4fa5ede640ef8dec9fdc2505aaa23100249ab7cee0677"}],"omissions":[],"project_id":"kungfu-xinfa-dogfood","status":[{"authorityRoot":"sha256:5c2ebe6adff2dc6f17f9515329456a21511a8b2316c9cebaa7883d6ef4082fd6","id":"kungfu-xinfa-dogfood.agent","parityGroup":"kungfu-xinfa-dogfood.contributor","status":"current"},{"authorityRoot":"sha256:5c2ebe6adff2dc6f17f9515329456a21511a8b2316c9cebaa7883d6ef4082fd6","id":"kungfu-xinfa-dogfood.human","parityGroup":"kungfu-xinfa-dogfood.contributor","status":"current"}],"visibility":"public"}}
